{
  "schema_version": 2,
  "registry_revision": 94,
  "repository": "LinzeColin/CodexProject",
  "last_updated_at": "2026-07-16T21:25:22Z",
  "bootstrap": {
    "imported_at": "2026-07-15T13:32:34Z",
    "implementation_base_sha": "cf4a26d54d8dc4f48fa943063ced2e3992237a92",
    "source_package_sha256": "64d267bd95757f9f00218125d6e388402f53c92b8e593608ec7ebb3d15a04c2f",
    "task_registry_sha256": "ae0d74247cca3b8c6f4fcb3fb348f9a4425436e2d723d4e46286c302f7ff305e",
    "roadmap_sha256": "dcd237176fc83f500258a6f7814e1ed41fca69c4fe532ef8a4f3777cc3941bf4",
    "task_count": 37
  },
  "allocations": [
    {
      "kind": "PG",
      "identifier": "PG.CodexProject.CLEANMEM1",
      "project": "CodexProject",
      "program": "CLEANMEM1",
      "idempotency_key": "taskpack-v3:PG.CodexProject.CLEANMEM1",
      "allocated_from_base_sha": "cf4a26d54d8dc4f48fa943063ced2e3992237a92",
      "source_ref": "taskpack-v3:sha256:ae0d74247cca3b8c6f4fcb3fb348f9a4425436e2d723d4e46286c302f7ff305e"
    },
    {
      "kind": "TSK",
      "identifier": "TSK.CodexProject.REPO1.0001",
      "acceptance_id": "ACC.CodexProject.REPO1.0001",
      "project": "CodexProject",
      "program": "REPO1",
      "sequence": 1,
      "idempotency_key": "taskpack-v3:TSK.CodexProject.REPO1.0001",
      "allocated_from_base_sha": "cf4a26d54d8dc4f48fa943063ced2e3992237a92",
      "source_ref": "taskpack-v3:sha256:ae0d74247cca3b8c6f4fcb3fb348f9a4425436e2d723d4e46286c302f7ff305e",
      "dependencies": []
    },
    {
      "kind": "TSK",
      "identifier": "TSK.CodexProject.REPO1.0002",
      "acceptance_id": "ACC.CodexProject.REPO1.0002",
      "project": "CodexProject",
      "program": "REPO1",
      "sequence": 2,
      "idempotency_key": "taskpack-v3:TSK.CodexProject.REPO1.0002",
      "allocated_from_base_sha": "cf4a26d54d8dc4f48fa943063ced2e3992237a92",
      "source_ref": "taskpack-v3:sha256:ae0d74247cca3b8c6f4fcb3fb348f9a4425436e2d723d4e46286c302f7ff305e",
      "dependencies": [
        "TSK.CodexProject.REPO1.0001"
      ]
    },
    {
      "kind": "TSK",
      "identifier": "TSK.CodexProject.REPO1.0003",
      "acceptance_id": "ACC.CodexProject.REPO1.0003",
      "project": "CodexProject",
      "program": "REPO1",
      "sequence": 3,
      "idempotency_key": "taskpack-v3:TSK.CodexProject.REPO1.0003",
      "allocated_from_base_sha": "cf4a26d54d8dc4f48fa943063ced2e3992237a92",
      "source_ref": "taskpack-v3:sha256:ae0d74247cca3b8c6f4fcb3fb348f9a4425436e2d723d4e46286c302f7ff305e",
      "dependencies": [
        "TSK.CodexProject.REPO1.0002"
      ]
    },
    {
      "kind": "TSK",
      "identifier": "TSK.CodexProject.REPO1.0004",
      "acceptance_id": "ACC.CodexProject.REPO1.0004",
      "project": "CodexProject",
      "program": "REPO1",
      "sequence": 4,
      "idempotency_key": "taskpack-v3:TSK.CodexProject.REPO1.0004",
      "allocated_from_base_sha": "cf4a26d54d8dc4f48fa943063ced2e3992237a92",
      "source_ref": "taskpack-v3:sha256:ae0d74247cca3b8c6f4fcb3fb348f9a4425436e2d723d4e46286c302f7ff305e",
      "dependencies": [
        "TSK.CodexProject.REPO1.0003"
      ]
    },
    {
      "kind": "TSK",
      "identifier": "TSK.CodexProject.REPO1.0005",
      "acceptance_id": "ACC.CodexProject.REPO1.0005",
      "project": "CodexProject",
      "program": "REPO1",
      "sequence": 5,
      "idempotency_key": "taskpack-v3:TSK.CodexProject.REPO1.0005",
      "allocated_from_base_sha": "cf4a26d54d8dc4f48fa943063ced2e3992237a92",
      "source_ref": "taskpack-v3:sha256:ae0d74247cca3b8c6f4fcb3fb348f9a4425436e2d723d4e46286c302f7ff305e",
      "dependencies": [
        "TSK.CodexProject.REPO1.0004"
      ]
    },
    {
      "kind": "TSK",
      "identifier": "TSK.CodexProject.REPO1.0006",
      "acceptance_id": "ACC.CodexProject.REPO1.0006",
      "project": "CodexProject",
      "program": "REPO1",
      "sequence": 6,
      "idempotency_key": "taskpack-v3:TSK.CodexProject.REPO1.0006",
      "allocated_from_base_sha": "cf4a26d54d8dc4f48fa943063ced2e3992237a92",
      "source_ref": "taskpack-v3:sha256:ae0d74247cca3b8c6f4fcb3fb348f9a4425436e2d723d4e46286c302f7ff305e",
      "dependencies": [
        "TSK.OpenAIDatabase.CLEAN1.0001"
      ]
    },
    {
      "kind": "TSK",
      "identifier": "TSK.CodexProject.REPO1.0007",
      "acceptance_id": "ACC.CodexProject.REPO1.0007",
      "project": "CodexProject",
      "program": "REPO1",
      "sequence": 7,
      "idempotency_key": "taskpack-v3:TSK.CodexProject.REPO1.0007",
      "allocated_from_base_sha": "cf4a26d54d8dc4f48fa943063ced2e3992237a92",
      "source_ref": "taskpack-v3:sha256:ae0d74247cca3b8c6f4fcb3fb348f9a4425436e2d723d4e46286c302f7ff305e",
      "dependencies": [
        "TSK.CodexProject.REPO1.0006"
      ]
    },
    {
      "kind": "TSK",
      "identifier": "TSK.CodexProject.REPO1.0008",
      "acceptance_id": "ACC.CodexProject.REPO1.0008",
      "project": "CodexProject",
      "program": "REPO1",
      "sequence": 8,
      "idempotency_key": "taskpack-v3:TSK.CodexProject.REPO1.0008",
      "allocated_from_base_sha": "cf4a26d54d8dc4f48fa943063ced2e3992237a92",
      "source_ref": "taskpack-v3:sha256:ae0d74247cca3b8c6f4fcb3fb348f9a4425436e2d723d4e46286c302f7ff305e",
      "dependencies": [
        "TSK.CodexProject.REPO1.0007"
      ]
    },
    {
      "kind": "TSK",
      "identifier": "TSK.CodexProject.REPO1.0009",
      "project": "CodexProject",
      "program": "REPO1",
      "sequence": 9,
      "idempotency_key": "control-handoff:TSK.CodexProject.REPO1.0009",
      "allocated_from_base_sha": "6b83d8e2b653e609233286338e3a810816d60543",
      "allocated_at": "2026-07-16T21:25:22Z",
      "source_ref": "allocator:control-handoff:TSK.CodexProject.REPO1.0009",
      "acceptance_id": "ACC.CodexProject.REPO1.0009",
      "dependencies": [
        "TSK.CodexProject.REPO1.0008"
      ]
    },
    {
      "kind": "EVT",
      "identifier": "EVT.OpenAIDatabase.CLEAN1.0001",
      "project": "OpenAIDatabase",
      "program": "CLEAN1",
      "sequence": 1,
      "idempotency_key": "task:TSK.OpenAIDatabase.CLEAN1.0003:event",
      "allocated_from_base_sha": "c746f8782ee409114875ca246545241b4449b932",
      "allocated_at": "2026-07-15T17:29:29Z",
      "source_ref": "allocator:task:TSK.OpenAIDatabase.CLEAN1.0003:event"
    },
    {
      "kind": "EVT",
      "identifier": "EVT.OpenAIDatabase.CLEAN1.0002",
      "project": "OpenAIDatabase",
      "program": "CLEAN1",
      "sequence": 2,
      "idempotency_key": "taskpack-v3:TSK.OpenAIDatabase.CLEAN1.0004:event",
      "allocated_from_base_sha": "61b97fe92e827918ebace1907a7de840343078fe",
      "allocated_at": "2026-07-15T17:45:54Z",
      "source_ref": "allocator:taskpack-v3:TSK.OpenAIDatabase.CLEAN1.0004:event"
    },
    {
      "kind": "EVT",
      "identifier": "EVT.OpenAIDatabase.CLEAN1.0003",
      "project": "OpenAIDatabase",
      "program": "CLEAN1",
      "sequence": 3,
      "idempotency_key": "taskpack-v3:TSK.OpenAIDatabase.CLEAN1.0005:event",
      "allocated_from_base_sha": "74dc2f7a52f1f1b7694c0433c5be87ce6da4cf73",
      "allocated_at": "2026-07-15T18:16:23Z",
      "source_ref": "allocator:taskpack-v3:TSK.OpenAIDatabase.CLEAN1.0005:event"
    },
    {
      "kind": "EVT",
      "identifier": "EVT.OpenAIDatabase.CLEAN1.0004",
      "project": "OpenAIDatabase",
      "program": "CLEAN1",
      "sequence": 4,
      "idempotency_key": "taskpack-v3:TSK.OpenAIDatabase.CLEAN1.0006:event",
      "allocated_from_base_sha": "46ae7fc0a702285f8dc1cb6349773a84d5d833ec",
      "allocated_at": "2026-07-15T18:46:54Z",
      "source_ref": "allocator:taskpack-v3:TSK.OpenAIDatabase.CLEAN1.0006:event"
    },
    {
      "kind": "EVT",
      "identifier": "EVT.OpenAIDatabase.CLEAN1.0005",
      "project": "OpenAIDatabase",
      "program": "CLEAN1",
      "sequence": 5,
      "idempotency_key": "taskpack-v3:TSK.OpenAIDatabase.CLEAN1.0007:event",
      "allocated_from_base_sha": "0b66ae8192d2285f2972516e4fe080b9d2267bb7",
      "allocated_at": "2026-07-15T19:12:52Z",
      "source_ref": "allocator:taskpack-v3:TSK.OpenAIDatabase.CLEAN1.0007:event"
    },
    {
      "kind": "EVT",
      "identifier": "EVT.OpenAIDatabase.CLEAN1.0006",
      "project": "OpenAIDatabase",
      "program": "CLEAN1",
      "sequence": 6,
      "idempotency_key": "taskpack-v3:TSK.OpenAIDatabase.CLEAN1.0008:event",
      "allocated_from_base_sha": "d05af208c0684a556831bfca04ec0c57b7747345",
      "allocated_at": "2026-07-15T20:51:13Z",
      "source_ref": "allocator:taskpack-v3:TSK.OpenAIDatabase.CLEAN1.0008:event"
    },
    {
      "kind": "EVT",
      "identifier": "EVT.OpenAIDatabase.CLEAN1.0007",
      "project": "OpenAIDatabase",
      "program": "CLEAN1",
      "sequence": 7,
      "idempotency_key": "taskpack-v3:TSK.OpenAIDatabase.CLEAN1.0009:event",
      "allocated_from_base_sha": "51040e08014b63f9bf7256c83bedfccea76e8b22",
      "allocated_at": "2026-07-15T23:28:11Z",
      "source_ref": "allocator:taskpack-v3:TSK.OpenAIDatabase.CLEAN1.0009:event"
    },
    {
      "kind": "EVT",
      "identifier": "EVT.OpenAIDatabase.CLEAN1.0008",
      "project": "OpenAIDatabase",
      "program": "CLEAN1",
      "sequence": 8,
      "idempotency_key": "taskpack-v3:TSK.OpenAIDatabase.CLEAN1.0010:event",
      "allocated_from_base_sha": "e1473638e75e1a6845a2956e390a066e4a67507a",
      "allocated_at": "2026-07-16T00:07:45Z",
      "source_ref": "allocator:taskpack-v3:TSK.OpenAIDatabase.CLEAN1.0010:event"
    },
    {
      "kind": "TSK",
      "identifier": "TSK.OpenAIDatabase.CLEAN1.0001",
      "acceptance_id": "ACC.OpenAIDatabase.CLEAN1.0001",
      "project": "OpenAIDatabase",
      "program": "CLEAN1",
      "sequence": 1,
      "idempotency_key": "taskpack-v3:TSK.OpenAIDatabase.CLEAN1.0001",
      "allocated_from_base_sha": "cf4a26d54d8dc4f48fa943063ced2e3992237a92",
      "source_ref": "taskpack-v3:sha256:ae0d74247cca3b8c6f4fcb3fb348f9a4425436e2d723d4e46286c302f7ff305e",
      "dependencies": [
        "TSK.CodexProject.REPO1.0005"
      ]
    },